{
  "schema_version": 1,
  "project_id": "klodhost",
  "inventory_timestamp": "2026-10-02T04:35:00.000Z",
  "repository": {
    "classification": "EXISTING_PARTIAL",
    "path": "/home/afuzaid/apps/klodhost",
    "git_state": "Separate afuzaid-owned Git repository on main; provider-neutral scaffold baseline committed as 00fc57548c64021bc4289b848f6aa8efaf4c52f4.",
    "framework": "Node.js and TypeScript provider-neutral scaffold; no production framework selected.",
    "runtime": "Node.js local project scripts verified; deployment/runtime configuration not verified.",
    "package_manager": "npm with committed package-lock.json.",
    "scripts": ["lint", "typecheck", "test", "build", "dev", "start"],
    "structure": [
      "README.md records approved separate platform ownership and provider-agnostic boundary.",
      ".gitignore excludes dependency/build outputs and environment files.",
      "TypeScript contracts/index source, unit tests, health test, package manifest, and lockfile are committed as the pre-Bundle-3 baseline.",
      "Separate Git metadata is on main with baseline commit 00fc57548c64021bc4289b848f6aa8efaf4c52f4.",
      "No provider adapters, Node Agent, database, or service definitions are present."
    ]
  },
  "classification": "EXISTING_PARTIAL",
  "environment": {
    "development": "NOT_FOUND_OR_NOT_REGISTERED",
    "staging": "NOT_FOUND_OR_NOT_REGISTERED",
    "production": "NOT_FOUND_OR_NOT_REGISTERED",
    "environment_variable_names": []
  },
  "services": [],
  "dependencies": [
    {
      "name": "KlodHost provider abstraction",
      "status": "NOT_FOUND",
      "evidence": [
        "No KlodHost-specific provider/infrastructure source tree found."
      ]
    },
    {
      "name": "Contabo integration",
      "status": "NOT_FOUND_LOCALLY; coupling risk unassessed",
      "evidence": [
        "No KlodHost or Contabo-specific implementation found in registered project roots."
      ]
    },
    {
      "name": "KlodHost Node Agent, billing, provisioning",
      "status": "NOT_FOUND",
      "evidence": [
        "No project repository, service definition, schema, or provider implementation found."
      ]
    }
  ],
  "shared_capabilities": [
    {
      "capability": "payments-billing",
      "status": "UNKNOWN / UNASSIGNED in portfolio capability registry",
      "evidence": [
        ".afuzactl/ecosystem/capabilities.json:payments-billing"
      ]
    },
    {
      "capability": "observability",
      "status": "UNKNOWN / UNASSIGNED in portfolio capability registry",
      "evidence": [
        ".afuzactl/ecosystem/capabilities.json:observability"
      ]
    },
    {
      "capability": "authentication",
      "status": "Approved shared-auth boundary; explicit AFUZA identity contract consumer integration remains unverified",
      "evidence": [
        ".afuzactl/ecosystem/capabilities.json:authentication"
      ]
    }
  ],
  "implementation_evidence": [
    {
      "area": "KlodHost repository skeleton",
      "status": "PARTIAL",
      "evidence": [
        "/home/afuzaid/apps/klodhost is an afuzaid-owned Git repository on main with committed pre-Bundle-3 baseline 00fc57548c64021bc4289b848f6aa8efaf4c52f4."
      ]
    },
    {
      "area": "Provider abstraction, Contabo provider, and Node Agent",
      "status": "MISSING",
      "evidence": [
        "No KlodHost-specific provider code or Node Agent found."
      ]
    },
    {
      "area": "Billing, provisioning, database, and services",
      "status": "MISSING",
      "evidence": [
        "No KlodHost-specific schema/migrations, service definitions, or provisioning code found."
      ]
    },
    {
      "area": "Staging domain/runtime and test/build",
      "status": "MISSING",
      "evidence": [
        "No KlodHost environment, Nginx host, unit, package manifest, or tests found."
      ]
    }
  ],
  "gaps": [
    "Deployment/runtime, database, services, and staging configuration are not established.",
    "Provider abstraction and Contabo coupling cannot be assessed without source code.",
    "Billing, provisioning, Node Agent, and deployment tests are absent locally."
  ],
  "conflicts": [],
  "blockers": [],
  "required_approvals": [],
  "recommended_next_action": "Bundle 2 execution remains the current proven lifecycle state; no human-test promotion or production rollout is claimed.",
  "autonomous_build_readiness": "AUTONOMOUS_BUILD_READY"
}
