{
  "schema_version": 1,
  "project_id": "chalwa.id",
  "inventory_timestamp": "2026-10-02T04:35:00.000Z",
  "repository": {
    "classification": "EXISTING_PARTIAL",
    "path": "/home/afuzaid/apps/chalwa",
    "git_state": "Separate afuzaid-owned Git repository on main; scaffold baseline committed as 4dd9a7c76954a6c662ba3130fb013027138c96ae.",
    "framework": "Node.js and TypeScript scaffold; no production framework selected.",
    "runtime": "Node.js local project scripts verified; deployment/runtime configuration not verified.",
    "package_manager": "npm with committed package-lock.json.",
    "scripts": ["lint", "typecheck", "test", "build", "dev", "start"],
    "structure": [
      "README.md records approved project ownership and domain boundaries.",
      ".gitignore excludes dependency/build outputs and environment files.",
      "TypeScript domain/index source, unit tests, health test, package manifest, and lockfile are committed as the pre-Bundle-3 baseline.",
      "Separate Git metadata is on main with baseline commit 4dd9a7c76954a6c662ba3130fb013027138c96ae.",
      "No database, migrations, or production service definitions are present."
    ]
  },
  "classification": "EXISTING_PARTIAL",
  "environment": {
    "development": "NOT_FOUND_OR_NOT_REGISTERED",
    "staging": "NOT_FOUND_OR_NOT_REGISTERED",
    "production": "NOT_FOUND_OR_NOT_REGISTERED",
    "environment_variable_names": []
  },
  "services": [],
  "dependencies": [
    {
      "name": "Afuza authentication",
      "status": "APPROVED_SHARED_CAPABILITY_BOUNDARY; explicit consumer contract integration remains unverified",
      "evidence": [
        ".afuzactl/ecosystem/capabilities.json:authentication"
      ]
    },
    {
      "name": "Afuza AI generation",
      "status": "APPROVED_SHARED_CAPABILITY_BOUNDARY; explicit consumer contract integration remains unverified",
      "evidence": [
        ".afuzactl/ecosystem/capabilities.json:ai-generation"
      ]
    },
    {
      "name": "Afuza asset storage",
      "status": "CANDIDATE_SHARED_CAPABILITY; CHALWA contract unresolved",
      "evidence": [
        ".afuzactl/ecosystem/capabilities.json:asset-storage"
      ]
    },
    {
      "name": "Afuza publishing",
      "status": "CANDIDATE_SHARED_CAPABILITY; CHALWA contract unresolved",
      "evidence": [
        ".afuzactl/ecosystem/capabilities.json:publishing"
      ]
    }
  ],
  "shared_capabilities": [
    {
      "capability": "authentication",
      "status": "APPROVED_REUSE_BOUNDARY; authentication contract compatibility remains unverified",
      "evidence": [
        ".afuzactl/ecosystem/capabilities.json"
      ]
    },
    {
      "capability": "ai-generation",
      "status": "CANDIDATE; provider/workflow contract unverified",
      "evidence": [
        ".afuzactl/ecosystem/capabilities.json"
      ]
    },
    {
      "capability": "asset-storage",
      "status": "CANDIDATE; tenant/storage boundary unverified",
      "evidence": [
        ".afuzactl/ecosystem/capabilities.json"
      ]
    },
    {
      "capability": "publishing",
      "status": "SHARED_CORE in AFUZA.ID; CHALWA integration unverified",
      "evidence": [
        ".afuzactl/ecosystem/capabilities.json"
      ]
    }
  ],
  "implementation_evidence": [
    {
      "area": "CHALWA repository skeleton",
      "status": "PARTIAL",
      "evidence": [
        "/home/afuzaid/apps/chalwa is an afuzaid-owned Git repository on main with committed pre-Bundle-3 baseline 4dd9a7c76954a6c662ba3130fb013027138c96ae."
      ]
    },
    {
      "area": "Database, migrations, authentication, tests, and build",
      "status": "MISSING",
      "evidence": [
        "No database migrations, authentication implementation, or service definitions are present in the baseline."
      ]
    },
    {
      "area": "Product and order workflow",
      "status": "MISSING",
      "evidence": [
        "No CHALWA-specific implementation found; adjacent AFUZA.ID capabilities are not counted as CHALWA implementation."
      ]
    },
    {
      "area": "Verification gates",
      "status": "MISSING",
      "evidence": [
        "Baseline lint, typecheck, 7 unit tests, and build pass; Bundle 3 lifecycle/RBAC gates have not been implemented."
      ]
    }
  ],
  "gaps": [
    "No production framework, database, migrations, or deployment runtime is configured.",
    "Shared-service consumer contracts and staging runtime/domain remain unverified."
  ],
  "conflicts": [],
  "blockers": [],
  "required_approvals": [],
  "recommended_next_action": "Bundle 2 execution remains the current proven lifecycle state; no human-test promotion or production rollout is claimed.",
  "autonomous_build_readiness": "AUTONOMOUS_BUILD_READY"
}
